WORD EXCEL POWER POINT w pracy asystentki / sekretarki.;Informatyka i telekomunikacja;650.00;650.00;https://static.szkolenia.com/public/companies/18/209/thumb/logo_na_szkolenia_com-1593524851.png;1;Szkolenie Social media – wizerunek marki i budowanie społeczności skierowane jest do osób, które budują markę firmy lub markę osobistą. Celem szkolenia jest usystematyzowanie wiedzy o serwisach społecznościowych, by uczestnicy trafnie dobierali kanał komunikacji do celów marketingowych oraz treść do poszczególnych platform. Szkolenie uczy jak zbudować strategię działania w social media opartą o filary content marketingu, by działaniami marketingowymi online skutecznie osiągać cele komunikacyjne;999999
MS EXCEL dla zaawansowanych - Analiza danych i prezentacja analizy danych (Advanced Excel) - 2-dniowe warsztaty.;Informatyka i telekomunikacja;140.00;113.82;https://static.szkolenia.com/public/companies/1333/1361/thumb/langasgroup_orange_final-1591204612.png;1;ZARZĄDZANIE, PRODUKCJA Jak efektywne są zespoły, a jakie mogłyby  być?Jak wyposażyć menedżerów w kluczowe kompetencje a zespołom dać dobrych menedżerów?Zapraszamy na warsztat, który z jednej strony wspiera menedżerów w odnalezieniu się w kluczowej roli, a z drugiej strony pokazuje skuteczne rozwiązania dla najczęściej pojawiających się dylematów w zarządzaniu ludźmi, które można napotkać podczas  współpracy z zespołem. KorzyściZdobędziesz wiedzę i wskazówki w oparciu o wieloletnie doświadczenie;999999
Praktyczne wykorzystanie aplikacji MS EXCEL - do tworzenia analiz i prezentacji danych.;Informatyka i telekomunikacja;140.00;113.82;https://static.szkolenia.com/public/companies/359/365/thumb/logo_tqmsoft-sp-z-oo-sp-k-1557487945.jpg;1;Program szkolenia:Cel i zakres zastosowania procedury akceptacji procesu produkcyjnego i wyrobu PPAAnaliza różnic pomiędzy VDA2 2020 i VDA2 2012Rozpoczęcie procedury PPAProcesy specjalne:           o    Zastosowanie wielu kroków           o    Małe serie           o    Postępowanie z wariantami wyrobuPlanowanie i uzgodnienia w zakresie PPA Agreement ( grupy wyrobów, warianty, kroki, rekwalifikacja)Kolejność realizacji procedury PPAWykonanie procedury PPA (akceptacja procesu produkcyjnego/ produ;999999
Bezpieczeństwo Firm i Instytucji w praktyce - zabezpieczenia dokumentów i plików, ludzi, budynków. 2-dniowe szkolenie.;Informatyka i telekomunikacja;140.00;113.82;https://static.szkolenia.com/public/companies/673/683/thumb/logo_osrodek-edukacyjny-forum-anna-hoffmann-1557488091.jpg;1;Adresaci: *  Osoby pracujące w działach komunikacji, marketingu i public relations w firmach, instytucjach i organizacjach*  Specjaliści Social Media i Content Marketing *  Dziennikarze, redaktorzy (dzienniki, tygodniki, portale internetowe, radio, telewizja)*  Dziennikarze firmowi (magazyny firmowe, internet, intranet, newslettery...) *  Blogerzy i copywriterzy Program szkolenia:9.30-10.30 Myśl jak Twój czytelnik: jak ludzie konsumują treści w internecieJak smartfony i media społecznościowe zm;999999
Cyberbezpieczeństwo dla pracowników biurowych;Informatyka i telekomunikacja;140.00;113.82;https://static.szkolenia.com/public/companies/673/683/thumb/logo_osrodek-edukacyjny-forum-anna-hoffmann-1557488091.jpg;1;Mogą się skoncentrować zaledwie przez 8 sekund, najczęściej tylko skanują strony internetowe i oglądają wideo na Youtube, a jeśli już coś czytają to głównie tytuły. Jak dotrzeć do internautów ery Facebooka? Na tym szkoleniu poznasz nowe techniki komunikacji i marketingu wizualnego, zobaczysz jakie są tajniki snack contentu, który bije rekordy popularności nie tylko na Tiktoku i nauczysz się jak opowiadać historie przy pomocy obrazów, by skutecznie wypromować swój urząd, instytucję lub organizac;999999
ONLINE: MS Excel w dziale finansowym;Informatyka i telekomunikacja;1045.50;850.00;https://static.szkolenia.com/public/companies/359/365/thumb/logo_tqmsoft-sp-z-oo-sp-k-1557487945.jpg;1;Zakres tematyczny szkolenia PROGRAM I ĆWICZENIA1. Wprowadzenie do metodologii Lean:Historia Lean.5 podstawowych zasad Lean.Lean manufacturinga Six Sigma.Implementacja Lean.Kaizen i Kaikaku.Cele wdrażania Lean w firmie.2. Lean w zarządzaniu procesami produkcyjnymi:Rodzaje marnotrawstwa.Mapowanie strumienia wartości VSM.TPM i jego narzędzia (OEE, SMED itp.).JiT.Kanban SYMULACJA ciągłego przepływu.3. Organizacja stanowiska Pracy:5S.Elementy standardu procesu.Standard work content.Cycle time - Czas;999999
O365 - MS Teams. Praca w szkole. Kurs dla nauczycieli;Informatyka i telekomunikacja;984.00;800.00;https://static.szkolenia.com/public/companies/359/365/thumb/logo_tqmsoft-sp-z-oo-sp-k-1557487945.jpg;1;Zakres tematyczny szkoleniaModuł I.1.       Wprowadzenie do TPM2.       Określenie  strategii TPM - wybór strategii dla maszyn kluczowych –diagram decyzyjny.3.       Określenie strategii TPM dla firmy, Filary TPM:·         Rola Działu Utrzymania Ruchu oraz Autonomous Maintenance.·         Strategie utrzymania ruchu – ukierunkowane doskonalenie.·         Specjalistyczne utrzymanie.·         Projektowanie i rozruch nowych urządzeń.·         Utrzymanie dla jakości.·         Jakość totalna a TPM.· ;999999
Szkolenie MS Access - operacje średniozaawansowane;Informatyka i telekomunikacja;990.00;804.88;https://static.szkolenia.com/public/companies/2935/2096/thumb/synergia-logo-1615555515.jpg;1;     ;999999
Instrukcja Kancelaryjna w systemie bezdziennikowym tradycyjnym oraz w systemie EZD;Informatyka i telekomunikacja;990.00;804.88;https://static.szkolenia.com/public/companies/2935/2096/thumb/synergia-logo-1615555515.jpg;1; ;999999
Szkolenie MS 10969 Active Directory Services with Windows Server.;Informatyka i telekomunikacja;4305.00;3500.00;https://static.szkolenia.com/public/companies/1814/1858/thumb/logo_effect-group-sp-z-oo-1557488606.jpg;1;CEL I PROGRAM SZKOLENIAKorzyści dla uczestników:Poznanie metod zbierania i weryfikacji danych dotyczących rynku produktów i ich dostawców oraz budowania odpowiednich strategii zakupowych,Poznanie efektywnych metod zarządzania grupami asortymentowych i dostosowania do nich odpowiednich strategii zakupowychPoznanie różnych sposobów redukcji wydatków zakupów poprzez dobranie kryteriów i zasad wyboru dostawcówPoznanie narzędzi oraz etapów zbudowania i rozwijania relacji z dostawcami, szczególnie w ;999999
MS Excel poziom średni i zaawansowany. Szkolenie online - STREAMING WEBINAR „LIVE”;Informatyka i telekomunikacja;4305.00;3500.00;https://static.szkolenia.com/public/companies/1814/1858/thumb/logo_effect-group-sp-z-oo-1557488606.jpg;1;CEL I PROGRAM SZKOLENIATo szkolenie, bez wychodzenia z pracy lub z domu, pozwoli Państwu na uczestnictwo w pełnowartościowych warsztatach i spotkaniach. Nie są to webinaria ani filmiki, podczas których odtwarzane są masowo wcześniej nagrane treści. To pełnowartościowe szkolenie z udziałem Trenera “na żywo”. Zapewniamy pełną interakcję, optymalną wymianę kompetencji – wiedzy, umiejętności i postaw.  Uczymy, reagując na bieżąco na potrzeby Uczestników naszych szkoleń. Do każdego szkolenia, każdy ;999999
E-commers w praktyce. Skuteczne narzędzia sprzedaży przez internet. Szkolenie online - STREAMING WEBINAR „LIVE”;Informatyka i telekomunikacja;1168.50;950.00;https://static.szkolenia.com/public/companies/1814/1858/thumb/logo_effect-group-sp-z-oo-1557488606.jpg;1;CEL I PROGRAM SZKOLENIACel szkoleniaPoznanie, uzupełnienie lub rozszerzenie wiedzy związanej z tematem szkolenia,Poznanie technik negocjacyjnych,Zapoznanie się z narzędziem zwiększenia efektywności negocjacyjnej czyli kompleksowego profilu negocjatora,Przedstawienie metody profesjonalnego przygotowania się do negocjacji. PROGRAM SZKOLENIA Przebieg, strategie i techniki negocjacyjne w fazach negocjacji:wstępnejnegocjacji właściwychzamykania negocjacjiProfilowanie partnera z drugiej strony stołu ;999999
online - Excel od podstaw;Informatyka i telekomunikacja;1168.50;950.00;https://static.szkolenia.com/public/companies/1312/1339/thumb/logo_atl-achievement-through-learning-sp-z-oo-1557488380.jpg;1;Zakres tematyczny szkoleniaSzczegółowe informacje uzyskacie Państwo pod nr telefonu:22 853 35 23, tel. kom.: 607 573 053  Adresaci szkolenia:szkolenie skierowane jest do pracowników odpowiadających za prawidłowe funkcjonowania magazynów różnych branż, w tym kierowników działów zaopatrzenia i magazynów, ich zastępców oraz pozostałych pracowników. Dzięki udziale w szkoleniu uczestnicy:będą potrafili opracować zakres zadań i odpowiedzialności pracowników gospodarki materiałowej i magazynowej,będą ;999999
online - Excel przydatne funkcje i raporty – poziom średniozaawansowany;Informatyka i telekomunikacja;971.70;790.00;https://static.szkolenia.com/public/companies/1312/1339/thumb/logo_atl-achievement-through-learning-sp-z-oo-1557488380.jpg;1;Zakres tematyczny szkolenia.Szczegółowe informacje uzyskacie Państwo pod nr telefonu: 22 853 35 23, tel. kom.: 607 573 053  PROGRAM SZKOLENIA: 1.       Informacja ogólne nt. Umowy wyjścia oraz towarzysząca jej deklaracja w sprawie ram przyszłych relacji UE/UK. 2.       Zakończenie okresu przejściowego, który będzie trwać do 31 grudnia 2020 r.          - w obszarze celnym okres przejściowy oznacza brak zmian w dotychczasowych relacjach z Wielką Brytanią. 3.       Etapowe wdrożenie kontroli grani;999999
Profesjonalny telemarketing i obsługa klienta przez telefon - 2-dniowe warsztaty praktyczne.;Informatyka i telekomunikacja;971.70;790.00;https://static.szkolenia.com/public/companies/1814/2106/thumb/logo_effect-group-sp-z-oo-1557488606.jpg;1;Cel szkolenia:zapoznanie uczestników z wymaganiami prawnymi dotyczącymi inwentaryzacji,nabycie praktycznej umiejętności przygotowania i przeprowadzenia inwentaryzacji,poznanie podstawowych błędów popełnianych podczas inwentaryzacji oraz metod ich zapobiegania,zaznajomienie uczestników z prawami i obowiązkami audytorów zewnętrznych. Szkolenie skierowane do:osób odpowiedzialnych za organizację oraz przeprowadzenie inwentaryzacji,osób zarządzających produkcją, logistyką, magazynami,pracowników mag;999999
Doręczenia elektroniczne w postępowaniu administracyjnym;Informatyka i telekomunikacja;608.85;495.00;https://static.szkolenia.com/public/companies/1814/1858/thumb/logo_effect-group-sp-z-oo-1557488606.jpg;1;CEL I PROGRAM SZKOLENIAKorzyści dla uczestników:Poznanie metod zbierania i weryfikacji danych dotyczących rynku produktów i ich dostawców oraz budowania odpowiednich strategii zakupowych,Poznanie efektywnych metod zarządzania grupami asortymentowych i dostosowania do nich odpowiednich strategii zakupowychPoznanie różnych sposobów redukcji wydatków zakupów poprzez dobranie kryteriów i zasad wyboru dostawcówPoznanie narzędzi oraz etapów zbudowania i rozwijania relacji z dostawcami, szczególnie w ;999999
Kurs DTP – Druk i publikacje;Informatyka i telekomunikacja;6519.00;5300.00;https://static.szkolenia.com/public/companies/1814/1858/thumb/logo_effect-group-sp-z-oo-1557488606.jpg;1;CEL I PROGRAM SZKOLENIATo szkolenie, bez wychodzenia z pracy lub z domu, pozwoli Państwu na uczestnictwo w pełnowartościowych warsztatach i spotkaniach. Nie są to webinaria ani filmiki, podczas których odtwarzane są masowo wcześniej nagrane treści. To pełnowartościowe szkolenie z udziałem Trenera “na żywo”. Zapewniamy pełną interakcję, optymalną wymianę kompetencji – wiedzy, umiejętności i postaw.  Uczymy, reagując na bieżąco na potrzeby Uczestników naszych szkoleń. Do każdego szkolenia, każdy ;999999
Scrum dla Scrum Mastera;Informatyka i telekomunikacja;2337.00;1900.00;https://static.szkolenia.com/public/companies/1814/1858/thumb/logo_effect-group-sp-z-oo-1557488606.jpg;1;CEL I PROGRAM SZKOLENIACel szkoleniaPoznanie, uzupełnienie lub rozszerzenie wiedzy związanej z tematem szkolenia,Poznanie technik negocjacyjnych,Zapoznanie się z narzędziem zwiększenia efektywności negocjacyjnej czyli kompleksowego profilu negocjatora,Przedstawienie metody profesjonalnego przygotowania się do negocjacji. PROGRAM SZKOLENIA Przebieg, strategie i techniki negocjacyjne w fazach negocjacji:wstępnejnegocjacji właściwychzamykania negocjacjiProfilowanie partnera z drugiej strony stołu ;999999
Scrum dla Product Ownera;Informatyka i telekomunikacja;2337.00;1900.00;https://static.szkolenia.com/public/companies/1312/1339/thumb/logo_atl-achievement-through-learning-sp-z-oo-1557488380.jpg;1;Zakres tematyczny szkoleniaSzczegółowe informacje uzyskacie Państwo pod nr telefonu:22 853 35 23, tel. kom.: 607 573 053  Adresaci szkolenia:szkolenie skierowane jest do pracowników odpowiadających za prawidłowe funkcjonowania magazynów różnych branż, w tym kierowników działów zaopatrzenia i magazynów, ich zastępców oraz pozostałych pracowników. Dzięki udziale w szkoleniu uczestnicy:będą potrafili opracować zakres zadań i odpowiedzialności pracowników gospodarki materiałowej i magazynowej,będą ;999999
Scrum w dużych organizacjach;Informatyka i telekomunikacja;1353.00;1100.00;https://static.szkolenia.com/public/companies/1312/1339/thumb/logo_atl-achievement-through-learning-sp-z-oo-1557488380.jpg;1;Zakres tematyczny szkolenia.Szczegółowe informacje uzyskacie Państwo pod nr telefonu: 22 853 35 23, tel. kom.: 607 573 053  PROGRAM SZKOLENIA: 1.       Informacja ogólne nt. Umowy wyjścia oraz towarzysząca jej deklaracja w sprawie ram przyszłych relacji UE/UK. 2.       Zakończenie okresu przejściowego, który będzie trwać do 31 grudnia 2020 r.          - w obszarze celnym okres przejściowy oznacza brak zmian w dotychczasowych relacjach z Wielką Brytanią. 3.       Etapowe wdrożenie kontroli grani;999999
Scrum dla każdego;Informatyka i telekomunikacja;2337.00;1900.00;https://static.szkolenia.com/public/companies/1814/2106/thumb/logo_effect-group-sp-z-oo-1557488606.jpg;1;Cel szkolenia:zapoznanie uczestników z wymaganiami prawnymi dotyczącymi inwentaryzacji,nabycie praktycznej umiejętności przygotowania i przeprowadzenia inwentaryzacji,poznanie podstawowych błędów popełnianych podczas inwentaryzacji oraz metod ich zapobiegania,zaznajomienie uczestników z prawami i obowiązkami audytorów zewnętrznych. Szkolenie skierowane do:osób odpowiedzialnych za organizację oraz przeprowadzenie inwentaryzacji,osób zarządzających produkcją, logistyką, magazynami,pracowników mag;999999
Agile w Biznesie;Informatyka i telekomunikacja;1968.00;1600.00;https://static.szkolenia.com/public/companies/1333/1361/thumb/langasgroup_orange_final-1591204612.png;1;Branża techniczna rządzi się swoimi prawami – nie znosi bujdy i niefachowości. Za to ceni ludzi, którzy znają się na robocie. Jednak, jako że wszyscy jesteśmy „ludźmi”, którzy mają swoje emocje, w programie znajdują się zagadnienia relacji międzyludzkich, mowy ciała, typów rozmówców.Jesteś ekspertem w swojej dziedzinie, ale Twoje umiejętności sprzedażowe wymagają doszlifowania? Poznaj metody sprzedaży doradczej i naucz się generować zyski z twoich kompetencji. CELE SZKOLENIAZwiększenie efektywn;999999
Zwinna analiza biznesowa;Informatyka i telekomunikacja;2337.00;1900.00;https://static.szkolenia.com/public/companies/1333/1361/thumb/langasgroup_orange_final-1591204612.png;1;Branża techniczna rządzi się swoimi prawami – nie znosi bujdy i niefachowości. Za to ceni ludzi, którzy znają się na robocie. Jednak, jako że wszyscy jesteśmy „ludźmi”, którzy mają swoje emocje, w programie znajdują się zagadnienia relacji międzyludzkich, mowy ciała, typów rozmówców.Jesteś ekspertem w swojej dziedzinie, ale Twoje umiejętności sprzedażowe wymagają doszlifowania? Poznaj metody sprzedaży doradczej i naucz się generować zyski z twoich kompetencji. CELE SZKOLENIAZwiększenie efektywn;999999
Analiza i modelowanie z wykorzystaniem User Stories i Story Mapping;Informatyka i telekomunikacja;1476.00;1200.00;https://static.szkolenia.com/public/companies/1333/1361/thumb/langasgroup_orange_final-1591204612.png;1;Czas wszelkich kryzysów to zawsze sprawdzian dla tych, którzy faktycznie dodają wartość. A jaką wartość dla biznesu przyniesie Twój dział zakupów?Dla znalezienia odpowiedzi na to pytanie kluczowe jest najpierw zrozumienie z jakimi problemami mierzy się cała Twoja firma. Jakie są bieżące potrzeby? Jakich problemów doświadcza biznes, dla którego pracujesz?Dział zakupów powinien zarządzać kosztami w sposób umożliwiający ich skalowalnie – teraz to ważniejsze, niż kiedykolwiek.Podczas szkolenia omów;999999
online - MS Excel – poziom początkujący;Informatyka i telekomunikacja;971.70;790.00;https://static.szkolenia.com/public/companies/1333/1361/thumb/langasgroup_orange_final-1591204612.png;1;Wielkość wydatków, jakie firmy zostawiają u swoich dostawców, wynosi średnio 60% wartości całego ich obrotu, a niejednokrotnie wskaźnik ten przekracza nawet 85%.W trakcie szkolenia omówione zostanie podejście do oceny w trzech wymiarach:strategicznym – czyli planie rozwoju bazy dostawców,taktycznym – czyli ocena potencjału i stabilności finansowej naszych kontrahentów, z którymi rozpoczynamy współpracę.operacyjnym, tworząc kompleksowe narzędzie do oceny współpracy z dostawcą. KorzyściPoznasz st;999999
Szkolenie online - MS Excel poziom średniozaawansowany;Informatyka i telekomunikacja;602.70;490.00;https://static.szkolenia.com/public/companies/1814/2106/thumb/logo_effect-group-sp-z-oo-1557488606.jpg;1;CEL I PROGRAM SZKOLENIAIstnieją opinie, że cała działalność człowieka jest sprzedawaniem – albo ktoś nas i firmę ,,kupi” – zaakceptuje produkty, wizerunek, profesjonalizm, kompetencje, umiejętności – albo ,,nie kupi”. Na tym szkoleniu chcemy przekazać uczestnikom nie tylko umiejętności merytoryczne, sprawdzone metody i techniki sprzedawania, ale przede wszystkim umiejętność wzmacniania i zarządzania własnymi zasobami, tworzenia postawy aktywności, sukcesu i obopólnych korzyści. Chcielibyśmy, ab;999999
Dokumentowanie wymagań i zarządzanie nimi: Model motywacji biznesowej Przypadki Użycia i Wymagania w SysML;Informatyka i telekomunikacja;602.70;490.00;https://static.szkolenia.com/public/companies/474/2021/thumb/kmstudio_szkolenia_logo-1575287084.png;1;Zakres tematyczny szkoleniaUzyskane umiejętności:precyzyjne i zrozumiałe przekazywanie wiedzyciekawe i perswazyjne mówieniepoprawne i skuteczne formułowanie celów i zadańkształtowanie u uczących się postawy odpowiedzialności za efektegzekwowanie umówudzielanie feedbackuodmawianiewyrażanie próśb i oczekiwań we współpracy z traineeumiejętność ciekawego mówieniastosowanie przykładówkorzystanie z wizualnych elementów prezentacjiradzenie sobie z tremą Szkolenie składa się z trzech bloków: rola trene;999999
Analiza obiektowa i projektowanie logiki oprogramowania z użyciem notacji UML;Informatyka i telekomunikacja;2337.00;1900.00;https://static.szkolenia.com/public/companies/474/2021/thumb/kmstudio_szkolenia_logo-1575287084.png;1;Zakres tematyczny szkoleniaNegocjacje to komunikacja, przebiegająca w trudnych warunkach: różnicy zdań, wysokiej  stawki i silnych emocji.  Negocjacje to sekwencja posunąć stron częściowego konfliktu interesów, w której dążą one do jego, możliwie najkorzystniejszego, rozwiązania. Negocjacje jak widać w poniższej tabeli są złotym środkiem między ucieczką, a walką.Negocjacje łączą się, sprzyjają, idą ręka w rękę z asertywnością, pozytywnym napięciem, spójnością, produktywnością, celowością. Szkol;999999
PLATFORMA EPUAP 2 I JEJ MIEJSCE W OBIEGU DOKUMENTÓW W URZĘDZIE – PRAKTYCZNE WARSZTATY;Informatyka i telekomunikacja;2337.00;1900.00;https://static.szkolenia.com/public/companies/474/2021/thumb/kmstudio_szkolenia_logo-1575287084.png;1;Zakres tematyczny szkoleniaNegocjacje to komunikacja, przebiegająca w trudnych warunkach: różnicy zdań, wysokiej  stawki i silnych emocji.  Negocjacje to sekwencja posunąć stron częściowego konfliktu interesów, w której dążą one do jego, możliwie najkorzystniejszego, rozwiązania. Negocjacje jak widać w poniższej tabeli są złotym środkiem między ucieczką, a walką.Negocjacje łączą się, sprzyjają, idą ręka w rękę z asertywnością, pozytywnym napięciem, spójnością, produktywnością, celowością. Szkol;999999
BEZPIECZNE I ODPOWIEDZIALNE KORZYSTANIE Z ZASOBÓW SIECI W PLACÓWCE OŚWIATOWEJ ON-LINE;Informatyka i telekomunikacja;356.70;290.00;https://static.szkolenia.com/public/companies/474/2021/thumb/kmstudio_szkolenia_logo-1575287084.png;1;Zakres tematyczny szkoleniaNegocjacje to komunikacja, przebiegająca w trudnych warunkach: różnicy zdań, wysokiej  stawki i silnych emocji.  Negocjacje to sekwencja posunąć stron częściowego konfliktu interesów, w której dążą one do jego, możliwie najkorzystniejszego, rozwiązania. Negocjacje jak widać w poniższej tabeli są złotym środkiem między ucieczką, a walką.Negocjacje łączą się, sprzyjają, idą ręka w rękę z asertywnością, pozytywnym napięciem, spójnością, produktywnością, celowością. Szkol;999999
Cyberbezpieczeństwo;Informatyka i telekomunikacja;356.70;290.00;https://static.szkolenia.com/public/companies/474/2021/thumb/kmstudio_szkolenia_logo-1575287084.png;1;Zakres tematyczny szkoleniaSzkolenie daje odpowiedź na takie pytania jak: w jaki sposób pogodzić stanowczośći uprzejmość wobec klienta, jak zorganizować obsługę w sposób systemowy, jak radzić sobie z własnymi trudnymi emocjami pojawiającymi się w kontakcie z klientem, jak stworzyć atmosferę przyjazną zarówno dla pracowników jak i klientów, w jaki sposób prowadzić rozmowy telefoniczne, jakie kryteria przyjmują klienci oceniając sposób ich obsługiwania.Kursanci pracują nad następującymi zagadnien;999999
Bezpieczeństwo informacji;Informatyka i telekomunikacja;356.70;290.00;https://static.szkolenia.com/public/companies/474/2021/thumb/kmstudio_szkolenia_logo-1575287084.png;1;Zakres tematyczny szkoleniaSzkolenie daje odpowiedź na takie pytania jak: w jaki sposób pogodzić stanowczośći uprzejmość wobec klienta, jak zorganizować obsługę w sposób systemowy, jak radzić sobie z własnymi trudnymi emocjami pojawiającymi się w kontakcie z klientem, jak stworzyć atmosferę przyjazną zarówno dla pracowników jak i klientów, w jaki sposób prowadzić rozmowy telefoniczne, jakie kryteria przyjmują klienci oceniając sposób ich obsługiwania.Kursanci pracują nad następującymi zagadnien;999999
Excel w praktyce;Informatyka i telekomunikacja;356.70;290.00;https://static.szkolenia.com/public/companies/474/2021/thumb/kmstudio_szkolenia_logo-1575287084.png;1;Zakres tematyczny szkoleniaSzkolenie ma na celu zapoznanie Uczestników z procesem sprzedaży od momentu przygotowania i planu do momentu zakończenia transakcji. Kurs  jest oparty o trzy moduły: proces, klient, handlowiec. W części pierwszej Uczestnicy poznają zasady prowadzenia procesu sprzedażowego od nawiązania pierwszego kontaktu z klientem, przez badanie potrzeb, prezentację oferty, przekonywanie, negocjacje, tricki sprzedażowe, strategie odpierania obiekcji po zamknięcie transakcji.W części;999999
Znakowanie i dystrybucja produktów w oparciu o standardy GS1;Informatyka i telekomunikacja;109.47;89.00;https://static.szkolenia.com/public/companies/474/2021/thumb/kmstudio_szkolenia_logo-1575287084.png;1;Zakres tematyczny szkoleniaSzkolenie ma na celu zapoznanie Uczestników z procesem sprzedaży od momentu przygotowania i planu do momentu zakończenia transakcji. Kurs  jest oparty o trzy moduły: proces, klient, handlowiec. W części pierwszej Uczestnicy poznają zasady prowadzenia procesu sprzedażowego od nawiązania pierwszego kontaktu z klientem, przez badanie potrzeb, prezentację oferty, przekonywanie, negocjacje, tricki sprzedażowe, strategie odpierania obiekcji po zamknięcie transakcji.W części;999999
Szkolenie online - MS Excel poziom podstawowy;Informatyka i telekomunikacja;109.47;89.00;https://static.szkolenia.com/public/companies/474/2021/thumb/kmstudio_szkolenia_logo-1575287084.png;1;Zakres tematyczny szkoleniaSzkolenie  obejmuje takie zagadnienia jak: identyfikacja klientów, pierwszy kontakt, analiza potrzeb, prezentacja oferty, negocjacje, wybrane techniki finalizacji transakcji, sposoby budowania i utrzymywania przyjaznych kontaktów z klientami. Kursanci pracują nad następującymi zagadnieniami: rozpoczęcie rozmowy, powitanie, prezentacja firmy oraz siebie przez telemarketera, przełamanie nieufności rozmówcy, szybkie dotarcie do odpowiedniej osoby, co i jak mówić, aby wzb;999999
Szkolenie online - MS Excel poziom zaawansowany;Informatyka i telekomunikacja;109.47;89.00;https://static.szkolenia.com/public/companies/1333/1361/thumb/langasgroup_orange_final-1591204612.png;1;Jak efektywne są zespoły, a jakie mogłyby być?Jak wyposażyć menedżerów w kluczowe kompetencje a zespołom dać dobrych menedżerów?Zapraszamy na dwudniowy warsztat, który z jednej strony wspiera menedżerów w odnalezieniu się w kluczowej roli, a z drugiej strony pokazuje skuteczne rozwiązania dla najczęściej pojawiających się dylematów w zarządzaniu ludźmi, które można napotkać podczas  współpracy z zespołem.KorzyściZdobędziesz wiedzę i wskazówki w oparciu o wieloletnie doświadczenie eksperta, w ja;999999
